{
  "title": "Manual de Transición",
  "subtitle": "De aquí a allá - Herramientas para construir el mundo que imaginamos",
  "author": "J. Irurtzun",
  "coAuthor": "& Claude",
  "sections": [
    {
      "id": "prologo",
      "title": "Prólogo",
      "chapters": [
        {
          "id": "prologo",
          "title": "La paradoja de la transición",
          "epigraph": {
            "text": "No podemos resolver nuestros problemas con el mismo pensamiento que usamos para crearlos.",
            "author": "Albert Einstein"
          },
          "content": "El Manifiesto de la Conciencia Compartida imaginaba otro mundo posible. Este manual intenta responder la pregunta que el manifiesto dejó abierta: ¿cómo llegamos de aquí a allá?\n\nLa pregunta parece sencilla. No lo es.\n\nVivimos una paradoja fundamental. No podemos esperar a que el sistema actual colapse para construir alternativas --- el colapso puede ser demasiado destructivo, demasiado caótico, demasiado doloroso. Pero tampoco podemos construir lo nuevo desde dentro de lo viejo sin contaminarnos --- las lógicas del sistema actual tienen tendencia a infiltrarse en todo lo que tocamos.\n\nSi esperamos la revolución, morimos esperando. Si intentamos reformar el sistema, el sistema nos reforma a nosotros. ¿Hay salida?\n\nEste manual propone una tercera vía: la prefiguración.\n\n## Prefigurar: vivir ya como si\n\nPrefigurar significa construir, aquí y ahora, las formas de vida que deseamos para el futuro. No esperar a que las condiciones sean perfectas. No pedir permiso al sistema que queremos trascender. Simplemente empezar.\n\nCrear una cooperativa es prefigurar una economía sin patrones. Practicar la toma de decisiones por consenso es prefigurar una democracia sin dominación. Compartir recursos en comunidad es prefigurar una sociedad más allá del individualismo posesivo.\n\nLa prefiguración no es escapismo ni ingenuidad. Es estrategia. Cada experimento prefigurativo es un laboratorio donde aprendemos qué funciona y qué no. Cada comunidad que vive diferente es una demostración de que es posible. Cada herramienta alternativa que creamos expande el espacio de lo imaginable.\n\nY cuando suficientes personas prefiguran suficientes alternativas, algo cambia. No por decreto ni por revolución violenta, sino por acumulación de prácticas que hacen obsoleto lo viejo. Como decía Buckminster Fuller: «Nunca cambias las cosas luchando contra la realidad existente. Para cambiar algo, construye un modelo nuevo que haga obsoleto el modelo existente.»\n\n## Qué encontrarás en este manual\n\nEste no es un libro de teoría. Es una caja de herramientas.\n\nEncontrarás:\n\n**Cartografía del cambio:** cómo ocurren las transiciones sistémicas, dónde intervenir, quiénes ya están construyendo alternativas.\n\n**Nuevas formas de organización:** cooperativas, organizaciones sin jefes, commons, DAOs --- modelos que ya existen y funcionan.\n\n**Herramientas concretas:** económicas, de gobernanza, digitales, relacionales, interiores --- el kit para construir.\n\n**Escalas de intervención:** desde lo personal hasta lo planetario, pasando por comunidad, organización y política.\n\n**La política del mientras tanto:** cómo vivir dignamente en el sistema viejo mientras construyes el nuevo.\n\n## El hilo conductor: Conciencia en Red\n\nA lo largo del manual usaremos como caso de estudio central un proyecto real: Conciencia en Red --- una iniciativa tecnológica para la transformación social que encarna los principios del manifiesto.\n\nNo es el único ejemplo posible, ni el modelo perfecto. Pero es un laboratorio vivo donde se están probando muchas de las ideas que aquí se proponen: arquitectura nodal, economía multi-valor, gobernanza distribuida, tecnología ética, expansión espiral de lo local a lo global.\n\nSu «Código Genético» --- un documento que define los principios inmutables del ecosistema --- ofrece un modelo replicable: suficientemente concreto para ser útil, suficientemente abierto para adaptarse a contextos diversos.\n\nLo usaremos como ejemplo, no como dogma. Toma lo que te sirva, adapta lo que necesites, descarta lo que no resuene.\n\n## Cómo usar este manual\n\nNo tienes que leerlo de principio a fin. Cada capítulo es relativamente autónomo. Puedes:\n\n--- Ir directamente a la escala que te interesa (personal, comunitaria, organizacional, política)\n\n--- Buscar herramientas específicas según tu necesidad (gobernanza, economía, tecnología)\n\n--- Empezar por los casos de estudio que más te inspiren\n\n--- Leer la teoría del cambio (Parte I) para tener marco general\n\nLo importante no es absorber información sino empezar a actuar. Un paso pequeño en la dirección correcta vale más que cien páginas leídas y olvidadas.\n\nBienvenidos a la transición.",
          "closingQuestion": "¿Qué paso pequeño puedes dar hoy en la dirección del mundo que imaginas?",
          "exercises": [
            {
              "id": "ex-prologo-1",
              "title": "Inventario de transiciones personales",
              "duration": "30 minutos",
              "description": "Reflexiona sobre las transiciones que has vivido en tu vida",
              "steps": [
                "Lista 3 transiciones importantes que hayas experimentado (cambio de trabajo, mudanza, cambio de relación, etc.)",
                "Para cada una, identifica: ¿Qué terminó? ¿Qué comenzó? ¿Qué hubo en medio?",
                "¿Qué recursos te ayudaron en cada transición?",
                "¿Qué aprendiste que puedas aplicar a transiciones colectivas?"
              ],
              "reflection": "Las transiciones personales nos enseñan sobre las colectivas. La zona de incertidumbre entre lo viejo y lo nuevo es donde ocurre la verdadera transformación."
            }
          ],
          "externalLinks": [
            {
              "title": "Transition Network",
              "url": "https://transitionnetwork.org/",
              "type": "organización",
              "description": "Red global de iniciativas de transición local"
            },
            {
              "title": "The Great Transition Initiative",
              "url": "https://greattransition.org/",
              "type": "think tank",
              "description": "Investigación sobre escenarios de transición global"
            }
          ],
          "linkedExercise": {
            "book": "toolkit-transicion",
            "chapterId": "toolkit-1",
            "title": "Inventario de Transiciones Personales",
            "duration": "45-60 minutos",
            "difficulty": "Básico"
          },
          "relatedManifiesto": {
            "book": "manifiesto",
            "bookTitle": "Manifiesto de la Conciencia Compartida",
            "chapterId": "cap18",
            "chapterTitle": "La Invitación",
            "relation": "La invitación al cambio"
          }
        }
      ]
    },
    {
      "id": "parte1",
      "title": "PARTE I",
      "subtitle": "Cartografía del Cambio",
      "chapters": [
        {
          "id": "cap1",
          "title": "Anatomía de las transiciones históricas",
          "epigraph": {
            "text": "La historia no se repite, pero rima.",
            "author": "Mark Twain"
          },